{
  "id": "asset_loveqigu_first_event_dc_01",
  "status": "ACTIVE",
  "created_at": "2026-06-15T09:00:00+08:00",
  "updated_at": "2026-06-15T09:00:00+08:00",
  "activity_id": "activity_loveqigu_first_event_v1",
  "asset_name": "爱企谷初见纪念藏品",
  "asset_type": "event_dc",
  "source_type": "activity_reward",
  "linked_coupon_template_id": "coupon_loveqigu_first_event_welcome_01",
  "linked_merchant_id": "merchant_loveqigu_cafe_01",
  "valid_from": "2026-06-20T09:00:00+08:00",
  "valid_to": "2026-07-20T21:00:00+08:00",
  "description": "完成首场活动任务后获得的纪念数字藏品。"
}
